{
  "asset_kind_hypotheses": [
    "UNKNOWN"
  ],
  "claim_level": "SIGNATURE_MATCH",
  "classification": {
    "calibration_state": "UNCALIBRATED",
    "confidence_label": "UNKNOWN",
    "probabilities": null,
    "ranked_labels": [
      "RF_PATTERN",
      "UNKNOWN"
    ]
  },
  "contradiction_refs": [],
  "evidence_refs": [
    "assoc_62187e80e4d88f3b1dbf6a8a151135630f828622",
    "assoc_84b9a9a5e3645370d9b44f98cf38b8a25644713c",
    "assoc_a8910510e7e8e2b7db15e1f67e31c70f32ad7ee3",
    "assoc_ae845206efd74d07f142518eaad5cf00b5fb479f",
    "assoc_af29a083a75afb56199292deecef65c5580fc16f",
    "assoc_d010e2063d2aa8a0383aa6a120328c17eacda13b",
    "assoc_d354cd99df50c8fa0d7684399a9f221358374e74",
    "assoc_f5e0ce16c7decfc9703ddc56ea29873db2072d39",
    "match_11be58f16cc4a08b3e660aa7f9247c6fda948451",
    "match_176cbabad39be9f440883258dfd4bd1ffb719581",
    "match_2a551b7fdf4ac400bf54ed29d0f62d3d0296ee14",
    "match_6d3a74c8b71ef1044ccdc4adbcefa3019422c2f7",
    "match_996ef7c1bda3712c581ce4d28cf8c132f6bbde8c",
    "match_a57663eb04cb611695f9795c11ff4f0d0585bd4a",
    "match_e05c449f256bfb1ca45c4fecc87c17e81ef16a7a",
    "match_e5bf9331bb662e1c97af09fee467178ce5f85e80",
    "mlineage_7c6dc8e5a4646eba18c392cf793261b6b3df6ac6",
    "mlineage_f48a9dd3b8ab856d3378936545f638fe0e56f341",
    "obs_1f8705164f5cb82180640989a686cba321065320",
    "obs_2828d225795e68e9eac28365433ab9e150e567f0",
    "obs_3223e31ef1d700dcce95db7118a8c71c18449aea",
    "obs_87bd9ac49dd0aabc58d206143408edf435c27d71",
    "obs_b4c63d3d758884701b2481c010e0aa377e42f6b6",
    "obs_d1ebafc67da3af44a2a72188020ae072e9d42c26",
    "obs_d3c141600973d68fe605ca29cb0cd4b1a659ab5a",
    "obs_d7ad2e15f8e35cca428f90d53ff46c8643ffeaeb",
    "partition_77aff0ac16b2a5eec351096669312f97778bcf56",
    "receipt_080e6124b20df77c48e56d812c3986a4f33a7419",
    "receipt_140466611aab9e2db7e9dfd0886fc3c62b3b3d5f",
    "receipt_5af266bc40f1fe46093c36375aaa9bde4339c38d",
    "receipt_63cd4466fb0a804e687633789345bdac7a9766d9",
    "receipt_9561a318a84eabd804d84ba76fe54eb8db0ba13b",
    "receipt_b1105edc91689f52729501697f31675ca63ef95d",
    "receipt_c744f297a5fa122cac14d806db09dd966f88857b",
    "receipt_d9f103b1d3ec921ac7aab522d6e88b18f7d2e7f4",
    "receipt_e28f97036fa721be2ae7b1738c9b7610e34e593e"
  ],
  "evidence_state": "MEASURED",
  "independent_source_lineages": [],
  "lifecycle_state": "CANDIDATE",
  "location": {
    "area_m2": 5676.0,
    "calibration_state": "UNCALIBRATED",
    "confidence_level": null,
    "geojson": {
      "coordinates": [
        [
          [
            -86.0003441,
            35.9996205
          ],
          [
            -85.9996105,
            35.9996205
          ],
          [
            -85.9996105,
            36.0003939
          ],
          [
            -86.0003441,
            36.0003939
          ],
          [
            -86.0003441,
            35.9996205
          ]
        ]
      ],
      "type": "Polygon"
    },
    "geometry_type": "POLYGON",
    "method": "RANK_RSSI_SUPPORT"
  },
  "measurement_lineages": [
    "mlineage_7c6dc8e5a4646eba18c392cf793261b6b3df6ac6",
    "mlineage_f48a9dd3b8ab856d3378936545f638fe0e56f341"
  ],
  "motion_state": "MOTION_UNRESOLVED",
  "node_id": "node_ed18ea3e03a6f47efdf320bad0eca12c",
  "parent_revision_hash": null,
  "publication_state": "PRIVATE_LOCAL",
  "receipt_id": "receipt_b4b3b1cc917bf2007395ad285e20ab993c640b5a",
  "revision": 1,
  "schema_version": "1.0.0",
  "trajectory": null,
  "updated_at_utc": "2026-08-22T12:02:30Z"
}
